,original_name,release_date,genres,overview,total_views,popularity,vote_average,vote_count,content
242,About Last Night,2014,Comedy Romance,"A modern reimagining of the classic romantic comedy, this contemporary version closely follows new love for two couples as they journey from the bar to the bedroom and are eventually put to the test in the real world.",416,14.986,6.0,444,"Comedy Romance2014A modern reimagining of the classic romantic comedy, this contemporary version closely follows new love for two couples as they journey from the bar to the bedroom and are eventually put to the test in the real world."
243,47 Ronin,2013,Drama Action Fantasy,"Kai—an outcast—joins Oishi, the leader of 47 outcast samurai.  Together they seek vengeance upon the treacherous overlord who killed their master and banished their kind.  To restore honour to their homeland, the warriors embark upon a quest that challenges them with a series of trials that would destroy ordinary warriors.",4024,26.877,6.1,3249,"Drama Action Fantasy2013Kai—an outcast—joins Oishi, the leader of 47 outcast samurai.  Together they seek vengeance upon the treacherous overlord who killed their master and banished their kind.  To restore honour to their homeland, the warriors embark upon a quest that challenges them with a series of trials that would destroy ordinary warriors."
244,Red Dragon,2002,Horror Thriller,"Former FBI Agent Will Graham, who was once almost killed by the savage Hannibal 'The Cannibal' Lecter, now has no choice but to face him again, as it seems Lecter is the only one who can help Graham track down a new serial killer.",2923,9.479,7.0,3476,"Horror Thriller2002Former FBI Agent Will Graham, who was once almost killed by the savage Hannibal 'The Cannibal' Lecter, now has no choice but to face him again, as it seems Lecter is the only one who can help Graham track down a new serial killer."
245,Trading Places,1983,Comedy,A snobbish investor and a wily street con-artist find their positions reversed as part of a bet by two callous millionaires.,353,29.453,7.2,2627,Comedy1983A snobbish investor and a wily street con-artist find their positions reversed as part of a bet by two callous millionaires.
246,Exam,2009,Mystery Thriller,The final candidates for a highly desirable corporate job are locked together in an exam room and given a test so simple and confusing that tension begins to unravel.,512,20.994,6.7,1667,Mystery Thriller2009The final candidates for a highly desirable corporate job are locked together in an exam room and given a test so simple and confusing that tension begins to unravel.
247,Oblivion,2013,Mystery Action Adventure Science Fiction,"Jack Harper is one of the last few drone repairmen stationed on Earth.  Part of a massive operation to extract vital resources after decades of war with a terrifying threat known as the Scavs, Jack’s mission is nearly complete.  His existence is brought crashing down when he rescues a beautiful  stranger from a downed spacecraft.  Her arrival triggers a chain of events that  forces him to question everything he knows and puts the fate of humanity in his hands.",5101,49.177,6.6,9392,"Mystery Action Adventure Science Fiction2013Jack Harper is one of the last few drone repairmen stationed on Earth.  Part of a massive operation to extract vital resources after decades of war with a terrifying threat known as the Scavs, Jack’s mission is nearly complete.  His existence is brought crashing down when he rescues a beautiful  stranger from a downed spacecraft.  Her arrival triggers a chain of events that  forces him to question everything he knows and puts the fate of humanity in his hands."
248,T2 Trainspotting,2017,Crime Drama,"After 20 years abroad, Mark Renton returns to Scotland and reunites with his old friends Sick Boy, Spud and Begbie.",729,17.858,6.9,2705,"Crime Drama2017After 20 years abroad, Mark Renton returns to Scotland and reunites with his old friends Sick Boy, Spud and Begbie."
249,Salt,2010,Mystery Action Thriller,"As a CIA officer, Evelyn Salt swore an oath to duty, honor and country. Her loyalty will be tested when a defector accuses her of being a Russian spy. Salt goes on the run, using all her skills and years of experience as a covert operative to elude capture. Salt's efforts to prove her innocence only serve to cast doubt on her motives, as the hunt to uncover the truth behind her identity continues and the question remains: ""Who is Salt?""",3433,67.679,6.4,4694,"Mystery Action Thriller2010As a CIA officer, Evelyn Salt swore an oath to duty, honor and country. Her loyalty will be tested when a defector accuses her of being a Russian spy. Salt goes on the run, using all her skills and years of experience as a covert operative to elude capture. Salt's efforts to prove her innocence only serve to cast doubt on her motives, as the hunt to uncover the truth behind her identity continues and the question remains: ""Who is Salt?"""
250,American Honey,2016,Drama,"A teenage girl with nothing to lose joins a traveling magazine sales crew, and gets caught up in a whirlwind of hard partying, law bending and young love as she criss-crosses the Midwest with a band of misfits.",219,9.978,6.8,694,"Drama2016A teenage girl with nothing to lose joins a traveling magazine sales crew, and gets caught up in a whirlwind of hard partying, law bending and young love as she criss-crosses the Midwest with a band of misfits."
251,Cop Out,2010,Comedy Crime Action,"Detectives Jimmy and Paul, despite nine years as partners, can still sometimes seem like polar opposites—especially when Paul's unpredictable antics get them suspended without pay. Already strapped for cash and trying to pay for his daughter's wedding, Jimmy decides to sell a rare baseball card that's worth tens of thousands. Unfortunately, when the collector's shop is robbed and the card vanishes with the crook, Paul and Jimmy end up going rogue, tracking down the card and the drug ring behind its theft, all on their own time and without any backup—except for each other.",105,19.118,5.6,1271,"Comedy Crime Action2010Detectives Jimmy and Paul, despite nine years as partners, can still sometimes seem like polar opposites—especially when Paul's unpredictable antics get them suspended without pay. Already strapped for cash and trying to pay for his daughter's wedding, Jimmy decides to sell a rare baseball card that's worth tens of thousands. Unfortunately, when the collector's shop is robbed and the card vanishes with the crook, Paul and Jimmy end up going rogue, tracking down the card and the drug ring behind its theft, all on their own time and without any backup—except for each other."
252,The Dark Tower,2017,Action Adventure Fantasy Science Fiction,A boy haunted by visions of a parallel world aids its disillusioned guardian in preventing the destruction of the nexus of universes known as the Dark Tower.,1630,38.725,5.7,4373,Action Adventure Fantasy Science Fiction2017A boy haunted by visions of a parallel world aids its disillusioned guardian in preventing the destruction of the nexus of universes known as the Dark Tower.
253,Nightcrawler,2014,Crime Drama Thriller,"When Lou Bloom, desperate for work, muscles into the world of L.A. crime journalism, he blurs the line between observer and participant to become the star of his own story. Aiding him in his effort is Nina, a TV-news veteran.",1035,88.712,7.7,9181,"Crime Drama Thriller2014When Lou Bloom, desperate for work, muscles into the world of L.A. crime journalism, he blurs the line between observer and participant to become the star of his own story. Aiding him in his effort is Nina, a TV-news veteran."
254,21 Grams,2003,Crime Drama Thriller,"Paul Rivers, an ailing mathematician lovelessly married to an English émigré; Christina Peck, an upper-middle-class suburban housewife and mother of two girls; and Jack Jordan, a born-again ex-con, are brought together by a terrible accident that changes their lives.",2626,15.353,7.4,2596,"Crime Drama Thriller2003Paul Rivers, an ailing mathematician lovelessly married to an English émigré; Christina Peck, an upper-middle-class suburban housewife and mother of two girls; and Jack Jordan, a born-again ex-con, are brought together by a terrible accident that changes their lives."
255,Little Fockers,2010,Comedy Romance,"It has taken 10 years, two little Fockers with wife Pam and countless hurdles for Greg to finally get in with his tightly wound father-in-law, Jack. After the cash-strapped dad takes a job moonlighting for a drug company, Jack's suspicions about his favorite male nurse come roaring back. When Greg and Pam's entire clan descends for the twins' birthday party, Greg must prove to the skeptical Jack that he's fully capable as the man of the house.",139,33.548,5.6,2802,"Comedy Romance2010It has taken 10 years, two little Fockers with wife Pam and countless hurdles for Greg to finally get in with his tightly wound father-in-law, Jack. After the cash-strapped dad takes a job moonlighting for a drug company, Jack's suspicions about his favorite male nurse come roaring back. When Greg and Pam's entire clan descends for the twins' birthday party, Greg must prove to the skeptical Jack that he's fully capable as the man of the house."
256,Battleship,2012,Action Adventure Science Fiction Thriller,"When mankind beams a radio signal into space, a reply comes from ‘Planet G’, in the form of several alien crafts that splash down in the waters off Hawaii. Lieutenant Alex Hopper is a weapons officer assigned to the USS John Paul Jones, part of an international naval coalition which becomes the world's last hope for survival as they engage the hostile alien force of unimaginable strength. While taking on the invaders, Hopper must also try to live up to the potential that his brother, and his fiancée's father—an Admiral—expect of him.",4165,53.585,5.8,4767,"Action Adventure Science Fiction Thriller2012When mankind beams a radio signal into space, a reply comes from ‘Planet G’, in the form of several alien crafts that splash down in the waters off Hawaii. Lieutenant Alex Hopper is a weapons officer assigned to the USS John Paul Jones, part of an international naval coalition which becomes the world's last hope for survival as they engage the hostile alien force of unimaginable strength. While taking on the invaders, Hopper must also try to live up to the potential that his brother, and his fiancée's father—an Admiral—expect of him."
257,Jumanji: Welcome to the Jungle,2017,Comedy Action Adventure Fantasy,"The tables are turned as four teenagers are sucked into Jumanji's world - pitted against rhinos, black mambas and an endless variety of jungle traps and puzzles. To survive, they'll play as characters from the game.",1879,81.77,6.8,11925,"Comedy Action Adventure Fantasy2017The tables are turned as four teenagers are sucked into Jumanji's world - pitted against rhinos, black mambas and an endless variety of jungle traps and puzzles. To survive, they'll play as characters from the game."
258,The Da Vinci Code,2006,Mystery Thriller,"A murder in Paris’ Louvre Museum and cryptic clues in some of Leonardo da Vinci’s most famous paintings lead to the discovery of a religious mystery. For 2,000 years a secret society closely guards information that — should it come to light — could rock the very foundations of Christianity.",1987,39.773,6.7,8004,"Mystery Thriller2006A murder in Paris’ Louvre Museum and cryptic clues in some of Leonardo da Vinci’s most famous paintings lead to the discovery of a religious mystery. For 2,000 years a secret society closely guards information that — should it come to light — could rock the very foundations of Christianity."
259,Born in China,2016,Documentary,"Venturing into the wilds of China, ""Born in China"" captures intimate moments with a panda bear and her growing cub, a young golden monkey who feels displaced by his baby sister, and a mother snow leopard struggling to raise her two cubs.",1364,23.362,7.3,141,"Documentary2016Venturing into the wilds of China, ""Born in China"" captures intimate moments with a panda bear and her growing cub, a young golden monkey who feels displaced by his baby sister, and a mother snow leopard struggling to raise her two cubs."
260,Killer Elite,2011,Action Adventure Thriller,"Based on a shocking true story, Killer Elite pits two of the world’s most elite operatives—Danny, an ex-special ops agent and Hunter, his longtime mentor—against the cunning leader of a secret military society. Covering the globe from Australia to Paris, London and the Middle East, Danny and Hunter are plunged into a highly dangerous game of cat and mouse—where the predators become the prey.",1718,41.081,6.3,1770,"Action Adventure Thriller2011Based on a shocking true story, Killer Elite pits two of the world’s most elite operatives—Danny, an ex-special ops agent and Hunter, his longtime mentor—against the cunning leader of a secret military society. Covering the globe from Australia to Paris, London and the Middle East, Danny and Hunter are plunged into a highly dangerous game of cat and mouse—where the predators become the prey."
261,Winston Churchill: Walking with Destiny,2010,Documentary,"Walking With Destiny highlights Churchill's years in the political wilderness, his early opposition to Adolf Hitler and Nazism, and his support for Jews under threat by the Nazi regime. As historian John Lukacs explains, Churchill may not have won the War in 1940, but without him, the War most certainly would have been lost. Sir Martin Gilbert, historical consultant for the film and Churchill's official biographer, adds that had Churchill's warnings about Nazi Germany's racial policies towards Jews been heeded in the early 1930's, the Holocaust may never have occurred. The film examines why Winston Churchill's legacy continues to be relevant in the 21st Century and explores why his leadership remains inspirational to current day political leaders and diplomats.",33,2.243,6.3,6,"Documentary2010Walking With Destiny highlights Churchill's years in the political wilderness, his early opposition to Adolf Hitler and Nazism, and his support for Jews under threat by the Nazi regime. As historian John Lukacs explains, Churchill may not have won the War in 1940, but without him, the War most certainly would have been lost. Sir Martin Gilbert, historical consultant for the film and Churchill's official biographer, adds that had Churchill's warnings about Nazi Germany's racial policies towards Jews been heeded in the early 1930's, the Holocaust may never have occurred. The film examines why Winston Churchill's legacy continues to be relevant in the 21st Century and explores why his leadership remains inspirational to current day political leaders and diplomats."
262,Sleepless,2017,Crime Action Thriller,"Undercover Las Vegas police officer Vincent Downs, who has got a lot of enemies, is caught in a high stakes web of corrupt cops and the mob-controlled casino underground. When a heist goes wrong, a crew of homicidal gangsters gets T, Downs’ teenage son. In one sleepless night, he will have to rescue his son T (who they got), evade an internal affairs investigation and bring the kidnappers to justice.",2238,27.289,5.9,1101,"Crime Action Thriller2017Undercover Las Vegas police officer Vincent Downs, who has got a lot of enemies, is caught in a high stakes web of corrupt cops and the mob-controlled casino underground. When a heist goes wrong, a crew of homicidal gangsters gets T, Downs’ teenage son. In one sleepless night, he will have to rescue his son T (who they got), evade an internal affairs investigation and bring the kidnappers to justice."
263,Pete's Dragon,2016,Family Adventure Fantasy,"For years, old wood carver Mr. Meacham has delighted local children with his tales of the fierce dragon that resides deep in the woods of the Pacific Northwest. To his daughter, Grace, who works as a forest ranger, these stories are little more than tall tales... until she meets Pete, a mysterious 10-year-old with no family and no home who claims to live in the woods with a giant, green dragon named Elliott. And from Pete's descriptions, Elliott seems remarkably similar to the dragon from Mr. Meacham's stories. With the help of Natalie, an 11-year-old girl whose father Jack owns the local lumber mill, Grace sets out to determine where Pete came from, where he belongs, and the truth about this dragon.",542,26.986,6.4,1928,"Family Adventure Fantasy2016For years, old wood carver Mr. Meacham has delighted local children with his tales of the fierce dragon that resides deep in the woods of the Pacific Northwest. To his daughter, Grace, who works as a forest ranger, these stories are little more than tall tales... until she meets Pete, a mysterious 10-year-old with no family and no home who claims to live in the woods with a giant, green dragon named Elliott. And from Pete's descriptions, Elliott seems remarkably similar to the dragon from Mr. Meacham's stories. With the help of Natalie, an 11-year-old girl whose father Jack owns the local lumber mill, Grace sets out to determine where Pete came from, where he belongs, and the truth about this dragon."
264,Dolphin Tale,2011,Drama Family,A story centered on the friendship between a boy and a dolphin whose tail was lost in a crab trap.,400,17.376,6.9,556,Drama Family2011A story centered on the friendship between a boy and a dolphin whose tail was lost in a crab trap.
265,Pressure,2015,Drama Thriller,Four divers are stuck deep underwater in a vessel after a freak storm destroys their ship. Will they survive?,947,8.437,5.7,204,Drama Thriller2015Four divers are stuck deep underwater in a vessel after a freak storm destroys their ship. Will they survive?
266,Enchanted,2007,Comedy Family Fantasy Romance,"The beautiful princess Giselle is banished by an evil queen from her magical, musical animated land and finds herself in the gritty reality of the streets of modern-day Manhattan. Shocked by this strange new environment that doesn't operate on a ""happily ever after"" basis, Giselle is now adrift in a chaotic world badly in need of enchantment. But when Giselle begins to fall in love with a charmingly flawed divorce lawyer who has come to her aid - even though she is already promised to a perfect fairy tale prince back home - she has to wonder: Can a storybook view of romance survive in the real world?",1414,70.594,6.8,4670,"Comedy Family Fantasy Romance2007The beautiful princess Giselle is banished by an evil queen from her magical, musical animated land and finds herself in the gritty reality of the streets of modern-day Manhattan. Shocked by this strange new environment that doesn't operate on a ""happily ever after"" basis, Giselle is now adrift in a chaotic world badly in need of enchantment. But when Giselle begins to fall in love with a charmingly flawed divorce lawyer who has come to her aid - even though she is already promised to a perfect fairy tale prince back home - she has to wonder: Can a storybook view of romance survive in the real world?"
267,Pixels,2015,Comedy Action Science Fiction,Video game experts are recruited by the military to fight 1980s-era video game characters who've attacked New York.,544,85.813,5.7,6572,Comedy Action Science Fiction2015Video game experts are recruited by the military to fight 1980s-era video game characters who've attacked New York.
268,Born Of War,2013,Action Thriller War,"Mina, a young college student, has her life ripped away after her family is killed. When she finds out their murder was part of a botched kidnapping to return her to her real father—a terrorist in the middle east.",317,1.535,4.2,11,"Action Thriller War2013Mina, a young college student, has her life ripped away after her family is killed. When she finds out their murder was part of a botched kidnapping to return her to her real father—a terrorist in the middle east."
269,11.6,2013,Drama Thriller,"In November 2009, French security van driver Toni Musulin makes off with nearly 12 million euros, then turns himself over to the authorities a week later.",1072,8.87,5.5,150,"Drama Thriller2013In November 2009, French security van driver Toni Musulin makes off with nearly 12 million euros, then turns himself over to the authorities a week later."
270,Norbit,2007,Comedy,"A mild-mannered guy who is engaged to a monstrous woman meets the woman of his dreams, and schemes to find a way to be with her.",599,63.905,5.6,1894,"Comedy2007A mild-mannered guy who is engaged to a monstrous woman meets the woman of his dreams, and schemes to find a way to be with her."
271,Mean Girls,2004,Comedy,"Cady Heron is a hit with The Plastics, the A-list girl clique at her new school, until she makes the mistake of falling for Aaron Samuels, the ex-boyfriend of alpha Plastic Regina George.",235,107.087,7.2,7324,"Comedy2004Cady Heron is a hit with The Plastics, the A-list girl clique at her new school, until she makes the mistake of falling for Aaron Samuels, the ex-boyfriend of alpha Plastic Regina George."
272,Marauders,2016,Crime Action Thriller,An untraceable group of elite bank robbers is chased by a suicidal FBI agent who uncovers a deeper purpose behind the robbery-homicides.,1735,22.177,5.8,506,Crime Action Thriller2016An untraceable group of elite bank robbers is chased by a suicidal FBI agent who uncovers a deeper purpose behind the robbery-homicides.
273,The Boy Next Door,2015,Thriller,"A recently cheated on married woman falls for a younger man who has moved in next door, but their torrid affair soon takes a dangerous turn.",3872,22.527,4.8,1851,"Thriller2015A recently cheated on married woman falls for a younger man who has moved in next door, but their torrid affair soon takes a dangerous turn."
274,Phantom Halo,2014,Crime Drama Thriller,Two brothers barely scrape by as their father continues to gamble and drink away the money they do bring home. They hatch a plan for a robbery but at what price?,497,4.579,6.0,42,Crime Drama Thriller2014Two brothers barely scrape by as their father continues to gamble and drink away the money they do bring home. They hatch a plan for a robbery but at what price?
275,Fun with Dick and Jane,2005,Comedy,"After Dick Harper loses his job at Globodyne in an Enron-esque collapse, he and his wife, Jane, turn to crime in order to handle the massive debt they now face. Two intelligent people, Dick and Jane actually get pretty good at robbing people and even enjoy it -- but they have second thoughts when they're reminded that crime can hurt innocent people. When the couple hears that Globodyne boss Jack McCallister actually swindled the company, they plot revenge.",895,19.525,6.2,2005,"Comedy2005After Dick Harper loses his job at Globodyne in an Enron-esque collapse, he and his wife, Jane, turn to crime in order to handle the massive debt they now face. Two intelligent people, Dick and Jane actually get pretty good at robbing people and even enjoy it -- but they have second thoughts when they're reminded that crime can hurt innocent people. When the couple hears that Globodyne boss Jack McCallister actually swindled the company, they plot revenge."
276,Finding Nemo,2003,Animation Family,"Nemo, an adventurous young clownfish, is unexpectedly taken from his Great Barrier Reef home to a dentist's office aquarium. It's up to his worrisome father Marlin and a friendly but forgetful fish Dory to bring Nemo home -- meeting vegetarian sharks, surfer dude turtles, hypnotic jellyfish, hungry seagulls, and more along the way.",874,143.19,7.8,16711,"Animation Family2003Nemo, an adventurous young clownfish, is unexpectedly taken from his Great Barrier Reef home to a dentist's office aquarium. It's up to his worrisome father Marlin and a friendly but forgetful fish Dory to bring Nemo home -- meeting vegetarian sharks, surfer dude turtles, hypnotic jellyfish, hungry seagulls, and more along the way."
277,Superbad,2007,Comedy,Two co-dependent high school seniors are forced to deal with separation anxiety after their plan to stage a booze-soaked party goes awry.,729,148.093,7.2,5918,Comedy2007Two co-dependent high school seniors are forced to deal with separation anxiety after their plan to stage a booze-soaked party goes awry.
278,Moms' Night Out,2014,Comedy,"Yearning for an evening without their kids, some friends plan a night out. But to do this, their husbands need to watch the kids. What can go wrong?",747,18.014,5.6,258,"Comedy2014Yearning for an evening without their kids, some friends plan a night out. But to do this, their husbands need to watch the kids. What can go wrong?"
279,Rugrats Go Wild,2003,Animation Comedy Family Adventure,"When the Rugrats find themselves stranded on a deserted island, they meet the Thornberrys, a family who agrees to help them escape.",313,17.85,6.2,250,"Animation Comedy Family Adventure2003When the Rugrats find themselves stranded on a deserted island, they meet the Thornberrys, a family who agrees to help them escape."
280,X-Men: Apocalypse,2016,Action Adventure Fantasy Science Fiction,"After the re-emergence of the world's first mutant, world-destroyer Apocalypse, the X-Men must unite to defeat his extinction level plan.",1076,104.089,6.5,11476,"Action Adventure Fantasy Science Fiction2016After the re-emergence of the world's first mutant, world-destroyer Apocalypse, the X-Men must unite to defeat his extinction level plan."
