,original_name,release_date,genres,overview,total_views,popularity,vote_average,vote_count,content
518,300: Rise of an Empire,2014,Drama Action War,"Greek general Themistokles attempts to unite all of Greece by leading the charge that will change the course of the war. Themistokles faces the massive invading Persian forces led by mortal-turned-god, Xerxes and Artemesia, the vengeful commander of the Persian navy.",572,66.834,6.1,5629,"Drama Action War2014Greek general Themistokles attempts to unite all of Greece by leading the charge that will change the course of the war. Themistokles faces the massive invading Persian forces led by mortal-turned-god, Xerxes and Artemesia, the vengeful commander of the Persian navy."
519,The Odd Life of Timothy Green,2012,Comedy Drama Family Fantasy,"A childless couple bury a box in their backyard, containing all of their wishes for an infant. Soon, a child is born, though Timothy Green is not all that he appears.",282,14.391,7.0,1028,"Comedy Drama Family Fantasy2012A childless couple bury a box in their backyard, containing all of their wishes for an infant. Soon, a child is born, though Timothy Green is not all that he appears."
520,Jackass Presents: Bad Grandpa .5,2013,Comedy,"Bad Grandpa .5 gives you a whole new perspective on the world of Irving Zisman with bonus scenes and pranks also featuring Spike Jonze as ""Gloria"" and Catherine Keener as Irving's wife ""Ellie"", plus a look at the evolution of Johnny Knoxville's naughty alter-ego, the makeup effects, and a behind-the-scenes peek at the idiocy it takes to make a hidden camera movie in public.",83,15.318,5.9,204,"Comedy2013Bad Grandpa .5 gives you a whole new perspective on the world of Irving Zisman with bonus scenes and pranks also featuring Spike Jonze as ""Gloria"" and Catherine Keener as Irving's wife ""Ellie"", plus a look at the evolution of Johnny Knoxville's naughty alter-ego, the makeup effects, and a behind-the-scenes peek at the idiocy it takes to make a hidden camera movie in public."
521,All Good Things,2010,Crime Drama Mystery Romance Thriller,"Newly-discovered facts, court records and speculation are used to elaborate the true love story and murder mystery of the most notorious unsolved murder case in New York history.",265,12.277,6.1,745,"Crime Drama Mystery Romance Thriller2010Newly-discovered facts, court records and speculation are used to elaborate the true love story and murder mystery of the most notorious unsolved murder case in New York history."
522,Jimmy Neutron: Boy Genius,2001,Animation Comedy Family Action Adventure Science Fiction,"Jimmy Neutron is a boy genius and way ahead of his friends, but when it comes to being cool, he's a little behind. All until one day when his parents, and parents all over Earth are kidnapped by aliens, it's up to him to lead all the children of the world to rescue their parents.",559,20.4,5.9,728,"Animation Comedy Family Action Adventure Science Fiction2001Jimmy Neutron is a boy genius and way ahead of his friends, but when it comes to being cool, he's a little behind. All until one day when his parents, and parents all over Earth are kidnapped by aliens, it's up to him to lead all the children of the world to rescue their parents."
523,Star Trek: The Motion Picture,1979,Mystery Adventure Science Fiction,"When a destructive space entity is spotted approaching Earth, Admiral Kirk resumes command of the Starship Enterprise in order to intercept, examine, and hopefully stop it.",84,22.285,6.5,1363,"Mystery Adventure Science Fiction1979When a destructive space entity is spotted approaching Earth, Admiral Kirk resumes command of the Starship Enterprise in order to intercept, examine, and hopefully stop it."
524,The General's Daughter,1999,Crime Drama Mystery Thriller,"When the body of Army Capt. Elizabeth Campbell is found on a Georgia military base, two investigators, Warrant Officers Paul Brenner and Sara Sunhill, are ordered to solve her murder. What they uncover is anything but clear-cut. Unseemly details emerge about Campbell's life, leading to allegations of a possible military coverup of her death and the involvement of her father, Lt. Gen. Joseph Campbell.",53,10.986,6.4,730,"Crime Drama Mystery Thriller1999When the body of Army Capt. Elizabeth Campbell is found on a Georgia military base, two investigators, Warrant Officers Paul Brenner and Sara Sunhill, are ordered to solve her murder. What they uncover is anything but clear-cut. Unseemly details emerge about Campbell's life, leading to allegations of a possible military coverup of her death and the involvement of her father, Lt. Gen. Joseph Campbell."
525,Phantom Punch,2008,Drama,"From his discovery by a priest while serving time at the Missouri State Penitentiary to the infamous 'Phantom Punch' by Cassius Clay which effectively ended his career, the movie spans the years from 1950 to Liston's mysterious and untimely death in 1971.",252,2.449,5.5,11,"Drama2008From his discovery by a priest while serving time at the Missouri State Penitentiary to the infamous 'Phantom Punch' by Cassius Clay which effectively ended his career, the movie spans the years from 1950 to Liston's mysterious and untimely death in 1971."
526,12 Rounds,2009,Crime Action Thriller,"When New Orleans Police Detective Danny Fisher stops a brilliant thief from getting away with a multimillion-dollar heist, the thief's girlfriend is accidentally killed. After escaping from prison, the criminal mastermind enacts his revenge, taunting Danny with 12 rounds of near-impossible puzzles and tasks that he must somehow complete to save the life of the woman he loves.",32,46.451,5.9,627,"Crime Action Thriller2009When New Orleans Police Detective Danny Fisher stops a brilliant thief from getting away with a multimillion-dollar heist, the thief's girlfriend is accidentally killed. After escaping from prison, the criminal mastermind enacts his revenge, taunting Danny with 12 rounds of near-impossible puzzles and tasks that he must somehow complete to save the life of the woman he loves."
527,American Psycho,2000,Crime Drama Thriller,"A wealthy New York investment banking executive hides his alternate psychopathic ego from his co-workers and friends as he escalates deeper into his illogical, gratuitous fantasies.",345,68.348,7.4,8283,"Crime Drama Thriller2000A wealthy New York investment banking executive hides his alternate psychopathic ego from his co-workers and friends as he escalates deeper into his illogical, gratuitous fantasies."
528,When in Rome,2010,Comedy Fantasy Romance,"After fishing out coins from a water fountain in Italy, cynical New Yorker Beth Harper finds herself being wooed by several ardent suitors. As she deals with the attention, Beth tries to figure out whether a charming reporter really loves her.",109,11.793,6.0,1061,"Comedy Fantasy Romance2010After fishing out coins from a water fountain in Italy, cynical New Yorker Beth Harper finds herself being wooed by several ardent suitors. As she deals with the attention, Beth tries to figure out whether a charming reporter really loves her."
529,Monster-in-Law,2005,Comedy Romance,"Office temp Charlotte Cantilini thinks she's found Mr. Right when she starts dating gorgeous surgeon Dr. Kevin Fields. But there's a problem standing in the way of everlasting bliss: Kevin's overbearing and controlling mother, Viola. Fearing she'll lose her son's affections forever, Viola decides to break up the happy couple by becoming the world's worst mother-in-law.",36,17.039,6.2,1404,"Comedy Romance2005Office temp Charlotte Cantilini thinks she's found Mr. Right when she starts dating gorgeous surgeon Dr. Kevin Fields. But there's a problem standing in the way of everlasting bliss: Kevin's overbearing and controlling mother, Viola. Fearing she'll lose her son's affections forever, Viola decides to break up the happy couple by becoming the world's worst mother-in-law."
530,Addams Family Values,1993,Comedy Family Fantasy,"Siblings Wednesday and Pugsley Addams will stop at nothing to get rid of Pubert, the new baby boy adored by parents Gomez and Morticia. Things go from bad to worse when the new ""black widow"" nanny, Debbie Jellinsky, launches her plan to add Fester to her collection of dead husbands.",302,105.108,6.9,2351,"Comedy Family Fantasy1993Siblings Wednesday and Pugsley Addams will stop at nothing to get rid of Pubert, the new baby boy adored by parents Gomez and Morticia. Things go from bad to worse when the new ""black widow"" nanny, Debbie Jellinsky, launches her plan to add Fester to her collection of dead husbands."
531,Escobar: Paradise Lost,2014,Romance Thriller,"For Pablo Escobar family is everything. When young surfer Nick falls for Escobar's niece, Maria, he finds his life on the line when he's pulled into the dangerous world of the family business.",238,25.353,6.3,689,"Romance Thriller2014For Pablo Escobar family is everything. When young surfer Nick falls for Escobar's niece, Maria, he finds his life on the line when he's pulled into the dangerous world of the family business."
532,Coherence,2013,Science Fiction Thriller,"On the night of an astronomical anomaly, eight friends at a dinner party experience a troubling chain of reality bending events.",113,25.451,7.3,2222,"Science Fiction Thriller2013On the night of an astronomical anomaly, eight friends at a dinner party experience a troubling chain of reality bending events."
533,American Hustle,2013,Crime Drama,"A conman and his seductive partner are forced to work for a wild FBI agent, who pushes them into a world of Jersey power-brokers and the Mafia.",754,25.939,6.8,6387,"Crime Drama2013A conman and his seductive partner are forced to work for a wild FBI agent, who pushes them into a world of Jersey power-brokers and the Mafia."
534,Appleseed Alpha,2014,Animation Action Science Fiction,"Based on the comic book by the creator of Ghost in the Shell, a young female soldier Deunan and her cyborg partner Briareos survive through the post World War 3 apocalyptic New York in search of human's future hope, the legendary city of Olympus.",970,13.703,6.7,299,"Animation Action Science Fiction2014Based on the comic book by the creator of Ghost in the Shell, a young female soldier Deunan and her cyborg partner Briareos survive through the post World War 3 apocalyptic New York in search of human's future hope, the legendary city of Olympus."
535,Shoot 'Em Up,2007,Comedy Crime Action Thriller,"A man named Mr. Smith delivers a woman's baby during a shootout, and is then called upon to protect the newborn from the army of gunmen.",143,27.049,6.4,1530,"Comedy Crime Action Thriller2007A man named Mr. Smith delivers a woman's baby during a shootout, and is then called upon to protect the newborn from the army of gunmen."
536,The Wolverine,2013,Action Adventure Fantasy Science Fiction,"Wolverine faces his ultimate nemesis - and tests of his physical, emotional, and mortal limits - in a life-changing voyage to modern-day Japan.",356,14.79,6.4,8372,"Action Adventure Fantasy Science Fiction2013Wolverine faces his ultimate nemesis - and tests of his physical, emotional, and mortal limits - in a life-changing voyage to modern-day Japan."
537,Arthur Newman,2012,Drama,"A story of a man who fakes his own death and assumes a new identity in order to escape his life, who then moves in with a woman who is also trying to leave her past behind.",109,7.879,5.7,180,"Drama2012A story of a man who fakes his own death and assumes a new identity in order to escape his life, who then moves in with a woman who is also trying to leave her past behind."
538,Proof of Life,2000,Drama Action Adventure Romance Thriller,"Alice hires a professional negotiator to obtain the release of her engineer husband, who has been kidnapped by anti-government guerrillas in South America.",23,14.387,6.1,643,"Drama Action Adventure Romance Thriller2000Alice hires a professional negotiator to obtain the release of her engineer husband, who has been kidnapped by anti-government guerrillas in South America."
539,A Walk Among the Tombstones,2014,Crime Drama Mystery Thriller,Private investigator Matthew Scudder is hired by a drug kingpin to find out who kidnapped and murdered his wife.,405,72.4,6.3,2421,Crime Drama Mystery Thriller2014Private investigator Matthew Scudder is hired by a drug kingpin to find out who kidnapped and murdered his wife.
540,Star Trek Into Darkness,2013,Action Adventure Science Fiction,"When the crew of the Enterprise is called back home, they find an unstoppable force of terror from within their own organization has detonated the fleet and everything it stands for, leaving our world in a state of crisis.  With a personal score to settle, Captain Kirk leads a manhunt to a war-zone world to capture a one man weapon of mass destruction. As our heroes are propelled into an epic chess game of life and death, love will be challenged, friendships will be torn apart, and sacrifices must be made for the only family Kirk has left: his crew.",154,44.92,7.3,8118,"Action Adventure Science Fiction2013When the crew of the Enterprise is called back home, they find an unstoppable force of terror from within their own organization has detonated the fleet and everything it stands for, leaving our world in a state of crisis.  With a personal score to settle, Captain Kirk leads a manhunt to a war-zone world to capture a one man weapon of mass destruction. As our heroes are propelled into an epic chess game of life and death, love will be challenged, friendships will be torn apart, and sacrifices must be made for the only family Kirk has left: his crew."
541,The Internship,2013,Comedy,Two recently laid-off men in their 40s try to make it as interns at a successful Internet company where their managers are in their 20s.,143,1.147,6.3,3685,Comedy2013Two recently laid-off men in their 40s try to make it as interns at a successful Internet company where their managers are in their 20s.
542,Jackie Brown,1997,Crime Drama Thriller,"Jackie Brown is a flight attendant who gets caught in the middle of smuggling cash into the country for her gunrunner boss. When the cops try to use Jackie to get to her boss, she hatches a plan — with help from a bail bondsman — to keep the money for herself.",614,21.661,7.3,5347,"Crime Drama Thriller1997Jackie Brown is a flight attendant who gets caught in the middle of smuggling cash into the country for her gunrunner boss. When the cops try to use Jackie to get to her boss, she hatches a plan — with help from a bail bondsman — to keep the money for herself."
543,The Armstrong Lie,2013,Documentary,"In 2009, Alex Gibney was hired to make a film about Lance Armstrong’s comeback to cycling. The project was shelved when the doping scandal erupted, and re-opened after Armstrong’s confession. The Armstrong Lie picks up in 2013 and presents a riveting, insider's view of the unraveling of one of the most extraordinary stories in the history of sports. As Lance Armstrong says himself, “I didn’t live a lot of lies, but I lived one big one.”",385,6.317,6.8,95,"Documentary2013In 2009, Alex Gibney was hired to make a film about Lance Armstrong’s comeback to cycling. The project was shelved when the doping scandal erupted, and re-opened after Armstrong’s confession. The Armstrong Lie picks up in 2013 and presents a riveting, insider's view of the unraveling of one of the most extraordinary stories in the history of sports. As Lance Armstrong says himself, “I didn’t live a lot of lies, but I lived one big one.”"
544,Tomorrowland,2015,Family Mystery Adventure Science Fiction,"Bound by a shared destiny, a bright, optimistic teen bursting with scientific curiosity and a former boy-genius inventor jaded by disillusionment embark on a danger-filled mission to unearth the secrets of an enigmatic place somewhere in time and space that exists in their collective memory as ""Tomorrowland.""",410,54.708,6.2,6241,"Family Mystery Adventure Science Fiction2015Bound by a shared destiny, a bright, optimistic teen bursting with scientific curiosity and a former boy-genius inventor jaded by disillusionment embark on a danger-filled mission to unearth the secrets of an enigmatic place somewhere in time and space that exists in their collective memory as ""Tomorrowland."""
545,True Grit,1969,Western,"The murder of her father sends a teenage tomboy on a mission of 'justice', which involves avenging her father's death. She recruits a tough old marshal, 'Rooster' Cogburn because he has 'true grit', and a reputation of getting the job done.",73,28.076,7.5,597,"Western1969The murder of her father sends a teenage tomboy on a mission of 'justice', which involves avenging her father's death. She recruits a tough old marshal, 'Rooster' Cogburn because he has 'true grit', and a reputation of getting the job done."
546,Beverly Hills Chihuahua,2008,Comedy Family Adventure Romance,"A pampered Beverly Hills chihuahua named Chloe who, while on vacation in Mexico with her owner Viv's niece, Rachel, gets lost and must rely on her friends to help her get back home before she is caught by a dognapper who wants to ransom her.",113,79.395,5.3,879,"Comedy Family Adventure Romance2008A pampered Beverly Hills chihuahua named Chloe who, while on vacation in Mexico with her owner Viv's niece, Rachel, gets lost and must rely on her friends to help her get back home before she is caught by a dognapper who wants to ransom her."
547,Ocean's Thirteen,2007,Crime Thriller,"Danny Ocean's team of criminals are back and composing a plan more personal than ever. When ruthless casino owner Willy Bank doublecrosses Reuben Tishkoff, causing a heart attack, Danny Ocean vows that he and his team will do anything to bring down Willy Bank along with everything he's got. Even if it means asking for help from an enemy.",145,26.818,6.7,5368,"Crime Thriller2007Danny Ocean's team of criminals are back and composing a plan more personal than ever. When ruthless casino owner Willy Bank doublecrosses Reuben Tishkoff, causing a heart attack, Danny Ocean vows that he and his team will do anything to bring down Willy Bank along with everything he's got. Even if it means asking for help from an enemy."
548,Coffin Rock,2009,Thriller,"A woman unable to conceive a child with her husband, despite years of trying, makes the drunken mistake of sleeping with a young stranger. The stranger then goes to terrifying lengths to prove his paternity.",421,1.788,5.6,21,"Thriller2009A woman unable to conceive a child with her husband, despite years of trying, makes the drunken mistake of sleeping with a young stranger. The stranger then goes to terrifying lengths to prove his paternity."
549,American Reunion,2012,Comedy,"The characters we met a little more than a decade ago return to East Great Falls for their high-school reunion. In one long-overdue weekend, they will discover what has changed, who hasn’t, and that time and distance can’t break the bonds of friendship.",35,73.096,6.3,3866,"Comedy2012The characters we met a little more than a decade ago return to East Great Falls for their high-school reunion. In one long-overdue weekend, they will discover what has changed, who hasn’t, and that time and distance can’t break the bonds of friendship."
550,Delivery Man,2013,Comedy,An affable underachiever finds out he's fathered 533 children through anonymous donations to a fertility clinic 20 years ago. Now he must decide whether or not to come forward when 142 of them file a lawsuit to reveal his identity.,668,33.282,6.2,1262,Comedy2013An affable underachiever finds out he's fathered 533 children through anonymous donations to a fertility clinic 20 years ago. Now he must decide whether or not to come forward when 142 of them file a lawsuit to reveal his identity.
551,Zoolander,2001,Comedy,"Clear the runway for Derek Zoolander, VH1's three-time male model of the year. His face falls when hippie-chic Hansel scooters in to steal this year's award. The evil fashion guru Mugatu seizes the opportunity to turn Derek into a killing machine. It's a well-designed conspiracy and only with the help of Hansel and a few well-chosen accessories like Matilda can Derek make the world safe for male models everywhere.",85,23.494,6.2,3592,"Comedy2001Clear the runway for Derek Zoolander, VH1's three-time male model of the year. His face falls when hippie-chic Hansel scooters in to steal this year's award. The evil fashion guru Mugatu seizes the opportunity to turn Derek into a killing machine. It's a well-designed conspiracy and only with the help of Hansel and a few well-chosen accessories like Matilda can Derek make the world safe for male models everywhere."
552,She's Out of My League,2010,Comedy Romance,"When he starts dating drop-dead gorgeous Molly, insecure airport security agent Kirk can't believe it. As his friends and family share their doubts about the relationship lasting, Kirk does everything he can to avoid losing Molly forever.",121,30.866,6.4,1711,"Comedy Romance2010When he starts dating drop-dead gorgeous Molly, insecure airport security agent Kirk can't believe it. As his friends and family share their doubts about the relationship lasting, Kirk does everything he can to avoid losing Molly forever."
553,It Follows,2014,Mystery Horror,"When carefree teenager Jay sleeps with her older boyfriend for the first time, she learns that she is the latest recipient of a fatal curse that is passed from victim to victim via sexual intercourse. Death, Jay learns, will creep inexorably toward her as either a friend or a stranger. Jay's friends don't believe her seemingly paranoid ravings, until they too begin to see the phantom assassins and band together to help her defend herself.",545,56.349,6.6,5391,"Mystery Horror2014When carefree teenager Jay sleeps with her older boyfriend for the first time, she learns that she is the latest recipient of a fatal curse that is passed from victim to victim via sexual intercourse. Death, Jay learns, will creep inexorably toward her as either a friend or a stranger. Jay's friends don't believe her seemingly paranoid ravings, until they too begin to see the phantom assassins and band together to help her defend herself."
554,Jupiter Ascending,2015,Action Fantasy Science Fiction,"In a universe where human genetic material is the most precious commodity, an impoverished young Earth woman becomes the key to strategic maneuvers and internal strife within a powerful dynasty…",47,71.465,5.4,5983,"Action Fantasy Science Fiction2015In a universe where human genetic material is the most precious commodity, an impoverished young Earth woman becomes the key to strategic maneuvers and internal strife within a powerful dynasty…"
555,The Heartbreak Kid,2007,Comedy Romance,"Eddie, the 40-year-old confirmed bachelor finally says ""I do"" to the beautiful and sexy Lila. But during their honeymoon in Mexico, the woman of his dreams turns out to be a total nightmare, and the guy who could never pull the trigger realizes he’s jumped the gun.",160,23.462,5.7,1353,"Comedy Romance2007Eddie, the 40-year-old confirmed bachelor finally says ""I do"" to the beautiful and sexy Lila. But during their honeymoon in Mexico, the woman of his dreams turns out to be a total nightmare, and the guy who could never pull the trigger realizes he’s jumped the gun."
556,Date Night,2010,Comedy Action Adventure,"Phil and Claire Foster fear that their mild-mannered relationship may be falling into a stale rut. During their weekly date night, their dinner reservation leads to their being mistaken for a couple of thieves—and now a number of unsavoury characters want Phil and Claire killed.",135,29.277,6.1,2455,"Comedy Action Adventure2010Phil and Claire Foster fear that their mild-mannered relationship may be falling into a stale rut. During their weekly date night, their dinner reservation leads to their being mistaken for a couple of thieves—and now a number of unsavoury characters want Phil and Claire killed."
557,Jersey Boys,2014,Drama Music,"A musical biopic of the Four Seasons—the rise, the tough times and personal clashes, and the ultimate triumph of a group of friends whose music became symbolic of a generation. Far from a mere tribute concert, it gets to the heart of the relationships at the centre of the group, with a special focus on frontman Frankie Valli, the small kid with the big falsetto.",85,11.856,6.8,590,"Drama Music2014A musical biopic of the Four Seasons—the rise, the tough times and personal clashes, and the ultimate triumph of a group of friends whose music became symbolic of a generation. Far from a mere tribute concert, it gets to the heart of the relationships at the centre of the group, with a special focus on frontman Frankie Valli, the small kid with the big falsetto."
558,The Girl with the Dragon Tattoo,2011,Crime Mystery Thriller,"This English-language adaptation of the Swedish novel by Stieg Larsson follows a disgraced journalist, Mikael Blomkvist, as he investigates the disappearance of a weary patriarch's niece from 40 years ago. He is aided by the pierced, tattooed, punk computer hacker named Lisbeth Salander. As they work together in the investigation, Blomkvist and Salander uncover immense corruption beyond anything they have ever imagined.",624,28.728,7.4,5928,"Crime Mystery Thriller2011This English-language adaptation of the Swedish novel by Stieg Larsson follows a disgraced journalist, Mikael Blomkvist, as he investigates the disappearance of a weary patriarch's niece from 40 years ago. He is aided by the pierced, tattooed, punk computer hacker named Lisbeth Salander. As they work together in the investigation, Blomkvist and Salander uncover immense corruption beyond anything they have ever imagined."
