,original_name,release_date,genres,overview,total_views,popularity,vote_average,vote_count,content
787,Gulliver's Travels,2010,Comedy Family Adventure Fantasy,"Travel writer Lemuel Gulliver takes an assignment in Bermuda, but ends up on the island of Liliput, where he towers over its tiny citizens.",95,32.517,5.2,2027,"Comedy Family Adventure Fantasy2010Travel writer Lemuel Gulliver takes an assignment in Bermuda, but ends up on the island of Liliput, where he towers over its tiny citizens."
788,Miss Congeniality,2000,Comedy Crime Action,"When the local FBI office receives a letter from a terrorist known only as 'The Citizen', it's quickly determined that he's planning his next act at the Miss America beauty pageant. Because tough-as-nails Gracie Hart is the only female Agent at the office, she's chosen to go undercover as the contestant from New Jersey.",93,30.952,6.5,3252,"Comedy Crime Action2000When the local FBI office receives a letter from a terrorist known only as 'The Citizen', it's quickly determined that he's planning his next act at the Miss America beauty pageant. Because tough-as-nails Gracie Hart is the only female Agent at the office, she's chosen to go undercover as the contestant from New Jersey."
789,Chronicle,2012,Drama Science Fiction Thriller,"Three high school students make an incredible discovery, leading to their developing uncanny powers beyond their understanding. As they learn to control their abilities and use them to their advantage, their lives start to spin out of control, and their darker sides begin to take over.",130,177.367,6.8,4476,"Drama Science Fiction Thriller2012Three high school students make an incredible discovery, leading to their developing uncanny powers beyond their understanding. As they learn to control their abilities and use them to their advantage, their lives start to spin out of control, and their darker sides begin to take over."
790,Ramona and Beezus,2010,Comedy Family,"Ramona is a little girl with a very big imagination and a nose for mischief. Her playful antics keep everyone in her loving family on their toes, including her older sister Beezus, who's just trying to survive her first year of high school. Through all the ups and downs of childhood, Ramona and Beezus learn that anything's possible when you believe in yourself and rely on each other.",200,18.448,6.5,687,"Comedy Family2010Ramona is a little girl with a very big imagination and a nose for mischief. Her playful antics keep everyone in her loving family on their toes, including her older sister Beezus, who's just trying to survive her first year of high school. Through all the ups and downs of childhood, Ramona and Beezus learn that anything's possible when you believe in yourself and rely on each other."
791,Star Trek: First Contact,1996,Action Adventure Science Fiction Thriller,"The Borg, a relentless race of cyborgs, are on a direct course for Earth. Violating orders to stay away from the battle, Captain Picard and the crew of the newly-commissioned USS Enterprise E pursue the Borg back in time to prevent the invaders from changing Federation history and assimilating the galaxy.",44,22.375,7.3,1426,"Action Adventure Science Fiction Thriller1996The Borg, a relentless race of cyborgs, are on a direct course for Earth. Violating orders to stay away from the battle, Captain Picard and the crew of the newly-commissioned USS Enterprise E pursue the Borg back in time to prevent the invaders from changing Federation history and assimilating the galaxy."
792,Dreamgirls,2006,Drama Music,Three young women dream of becoming pop stars—and get their wish when they're chosen to be backup singers for the legendary James 'Thunder' Early.,145,13.233,6.8,838,Drama Music2006Three young women dream of becoming pop stars—and get their wish when they're chosen to be backup singers for the legendary James 'Thunder' Early.
793,Water for Elephants,2011,Drama Romance,"In this captivating Depression-era melodrama, impetuous veterinary student Jacob Jankowski joins a celebrated circus as an animal caretaker but faces a wrenching dilemma when he's transfixed by angelic married performer Marlena.",108,9.257,7.0,2260,"Drama Romance2011In this captivating Depression-era melodrama, impetuous veterinary student Jacob Jankowski joins a celebrated circus as an animal caretaker but faces a wrenching dilemma when he's transfixed by angelic married performer Marlena."
794,The Town,2010,Crime Drama Thriller,"Doug MacRay is a longtime thief, who, smarter than the rest of his crew, is looking for his chance to exit the game. When a bank job leads to the group kidnapping an attractive branch manager, he takes on the role of monitoring her – but their burgeoning relationship threatens to unveil the identities of Doug and his crew to the FBI Agent who is on their case.",33,95.415,7.2,4154,"Crime Drama Thriller2010Doug MacRay is a longtime thief, who, smarter than the rest of his crew, is looking for his chance to exit the game. When a bank job leads to the group kidnapping an attractive branch manager, he takes on the role of monitoring her – but their burgeoning relationship threatens to unveil the identities of Doug and his crew to the FBI Agent who is on their case."
795,The Childhood of a Leader,2016,Drama,The chilling story of a young American boy living in France in 1918 whose father is working for the US government on the creation of the Treaty of Versailles. What he witnesses helps to mold his beliefs – and we witness the birth of a terrifying ego.,163,9.121,6.3,130,Drama2016The chilling story of a young American boy living in France in 1918 whose father is working for the US government on the creation of the Treaty of Versailles. What he witnesses helps to mold his beliefs – and we witness the birth of a terrifying ego.
796,Patriot Games,1992,Crime Drama Action Thriller,"When CIA Analyst Jack Ryan interferes with an IRA assassination, a renegade faction targets Jack and his family as revenge.",300,24.183,6.7,1288,"Crime Drama Action Thriller1992When CIA Analyst Jack Ryan interferes with an IRA assassination, a renegade faction targets Jack and his family as revenge."
797,Star Trek: Generations,1994,Action Adventure Science Fiction Thriller,Captain Jean-Luc Picard and the crew of the Enterprise-D find themselves at odds with the renegade scientist Soran who is destroying entire star systems. Only one man can help Picard stop Soran's scheme...and he's been dead for seventy-eight years.,75,11.322,6.5,1047,Action Adventure Science Fiction Thriller1994Captain Jean-Luc Picard and the crew of the Enterprise-D find themselves at odds with the renegade scientist Soran who is destroying entire star systems. Only one man can help Picard stop Soran's scheme...and he's been dead for seventy-eight years.
798,Learning to Drive,2014,Comedy Drama Romance,"As her marriage dissolves, a Manhattan writer takes driving lessons from a Sikh instructor with marriage troubles of his own. In each other's company they find the courage to get back on the road and the strength to take the wheel.",99,12.027,6.1,160,"Comedy Drama Romance2014As her marriage dissolves, a Manhattan writer takes driving lessons from a Sikh instructor with marriage troubles of his own. In each other's company they find the courage to get back on the road and the strength to take the wheel."
799,X-Men Origins: Wolverine,2009,Action Adventure Science Fiction Thriller,"After seeking to live a normal life, Logan sets out to avenge the death of his girlfriend by undergoing the mutant Weapon X program and becoming Wolverine.",93,13.095,6.3,9126,"Action Adventure Science Fiction Thriller2009After seeking to live a normal life, Logan sets out to avenge the death of his girlfriend by undergoing the mutant Weapon X program and becoming Wolverine."
800,Delgo,2008,Animation Comedy Family Adventure Fantasy Science Fiction,"In a divided land, it takes a rebellious boy and his clandestine love for a Princess of an opposing race to stop a war orchestrated by a power hungry villain.",133,7.119,5.1,48,"Animation Comedy Family Adventure Fantasy Science Fiction2008In a divided land, it takes a rebellious boy and his clandestine love for a Princess of an opposing race to stop a war orchestrated by a power hungry villain."
801,Cold Play,2008,Thriller,"Suspecting his wife, Indigo (Vanessa Branch), has been sleeping around, multimillionaire Winston Thorpe (D. David Morin) pays a private detective (Geno Andrews) to spy on her. But he never expected his hired man to climb into Indigo's bed and plot to steal his most prized possession. Now, he's got two problems: an unfaithful wife who despises him and a skilled investigator who's willing to take him for everything he's ever loved.",111,1.644,0.0,0,"Thriller2008Suspecting his wife, Indigo (Vanessa Branch), has been sleeping around, multimillionaire Winston Thorpe (D. David Morin) pays a private detective (Geno Andrews) to spy on her. But he never expected his hired man to climb into Indigo's bed and plot to steal his most prized possession. Now, he's got two problems: an unfaithful wife who despises him and a skilled investigator who's willing to take him for everything he's ever loved."
802,Splash,1984,Comedy Fantasy Romance,"A successful businessman falls in love with the girl of his dreams. There's one big complication though; he's fallen hook, line and sinker for a mermaid.",58,23.917,6.2,1086,"Comedy Fantasy Romance1984A successful businessman falls in love with the girl of his dreams. There's one big complication though; he's fallen hook, line and sinker for a mermaid."
803,The Final Destination,2009,Mystery Horror,"After a young man's premonition of a deadly race-car crash helps saves the lives of his peers, Death sets out to collect those who evaded their end.",59,67.816,5.6,2638,"Mystery Horror2009After a young man's premonition of a deadly race-car crash helps saves the lives of his peers, Death sets out to collect those who evaded their end."
804,Unbreakable,2000,Drama Mystery Thriller,"An ordinary man makes an extraordinary discovery when a train accident leaves his fellow passengers dead — and him unscathed. The answer to this mystery could lie with the mysterious Elijah Price, a man who suffers from a disease that renders his bones as fragile as glass.",72,36.515,7.1,7938,"Drama Mystery Thriller2000An ordinary man makes an extraordinary discovery when a train accident leaves his fellow passengers dead — and him unscathed. The answer to this mystery could lie with the mysterious Elijah Price, a man who suffers from a disease that renders his bones as fragile as glass."
805,Ghost Rider,2007,Action Fantasy Thriller,"In order to save his dying father, young stunt cyclist Johnny Blaze sells his soul to Mephistopheles and sadly parts from the pure-hearted Roxanne Simpson, the love of his life. Years later, Johnny's path crosses again with Roxanne, now a go-getting reporter, and also with Mephistopheles, who offers to release Johnny's soul if Johnny becomes the fabled, fiery 'Ghost Rider'.",50,54.313,5.5,4980,"Action Fantasy Thriller2007In order to save his dying father, young stunt cyclist Johnny Blaze sells his soul to Mephistopheles and sadly parts from the pure-hearted Roxanne Simpson, the love of his life. Years later, Johnny's path crosses again with Roxanne, now a go-getting reporter, and also with Mephistopheles, who offers to release Johnny's soul if Johnny becomes the fabled, fiery 'Ghost Rider'."
806,Batman Returns,1992,Action Fantasy,"While Batman deals with a deformed man calling himself the Penguin, an employee of a corrupt businessman transforms into the Catwoman.",23,40.83,6.9,5376,"Action Fantasy1992While Batman deals with a deformed man calling himself the Penguin, an employee of a corrupt businessman transforms into the Catwoman."
807,Partisan,2015,Drama Thriller,"On the edge of a crumbling city, 11-year-old Alexander lives in a sequestered commune alongside other children, their mothers, and charismatic leader, Gregori. Gregori teaches the children how to raise livestock, grow vegetables, work as a community - and how to kill. With the birth of a new baby brother weighing on his mind, Alexander begins to question Gregori’s overpowering influence on the children and their training to become assassins. Threatened by his increasing unwillingness to fall in line, Gregori’s behavior turns erratic and adversarial toward the child he once considered a son. With the two set dangerously at odds and the commune’s way of life disintegrating, the residents fear a violent resolution is at hand.",73,5.88,6.0,92,"Drama Thriller2015On the edge of a crumbling city, 11-year-old Alexander lives in a sequestered commune alongside other children, their mothers, and charismatic leader, Gregori. Gregori teaches the children how to raise livestock, grow vegetables, work as a community - and how to kill. With the birth of a new baby brother weighing on his mind, Alexander begins to question Gregori’s overpowering influence on the children and their training to become assassins. Threatened by his increasing unwillingness to fall in line, Gregori’s behavior turns erratic and adversarial toward the child he once considered a son. With the two set dangerously at odds and the commune’s way of life disintegrating, the residents fear a violent resolution is at hand."
808,The Rite,2011,Drama Horror Thriller,"Seminary student Michael Kovak reluctantly attends exorcism school at the Vatican. While he’s in Rome, Michael meets an unorthodox priest who introduces him to the darker side of his faith, uncovering the devil’s reach even to one of the holiest places on Earth.",122,32.405,6.1,1759,"Drama Horror Thriller2011Seminary student Michael Kovak reluctantly attends exorcism school at the Vatican. While he’s in Rome, Michael meets an unorthodox priest who introduces him to the darker side of his faith, uncovering the devil’s reach even to one of the holiest places on Earth."
809,Fat Albert,2004,Comedy Family Fantasy,"Animated character Fat Albert emerges from his TV universe into the real world, accompanied by his friends Rudy, Mushmouth, Old Weird Harold and Dumb Donald. Though the gang is flabbergasted by the modern world, they make new friends, and Albert attempts to help young Doris become popular. But things get complicated when Albert falls for her older sister, Lauri, and must turn to creator Bill Cosby for advice.",281,13.505,5.1,210,"Comedy Family Fantasy2004Animated character Fat Albert emerges from his TV universe into the real world, accompanied by his friends Rudy, Mushmouth, Old Weird Harold and Dumb Donald. Though the gang is flabbergasted by the modern world, they make new friends, and Albert attempts to help young Doris become popular. But things get complicated when Albert falls for her older sister, Lauri, and must turn to creator Bill Cosby for advice."
810,The Greatest Game Ever Played,2005,Drama,"A biopic of 20-year-old Francis Ouimet who defeated his golfing idol and 1900 US Open Champion, Harry Vardon.",38,12.455,7.3,367,"Drama2005A biopic of 20-year-old Francis Ouimet who defeated his golfing idol and 1900 US Open Champion, Harry Vardon."
811,The First Wives Club,1996,Comedy,"After years of helping their hubbies climb the ladder of success, three mid-life Manhattanites have been dumped for a newer, curvier model. But the trio is determined to turn their pain into gain. They come up with a cleverly devious plan to hit their exes where it really hurts - in the wallet!",65,13.901,6.7,633,"Comedy1996After years of helping their hubbies climb the ladder of success, three mid-life Manhattanites have been dumped for a newer, curvier model. But the trio is determined to turn their pain into gain. They come up with a cleverly devious plan to hit their exes where it really hurts - in the wallet!"
812,Horrible Bosses,2011,Comedy Crime,"For Nick, Kurt and Dale, the only thing that would make the daily grind more tolerable would be to grind their intolerable bosses into dust. Quitting is not an option, so, with the benefit of a few-too-many drinks and some dubious advice from a hustling ex-con, the three friends devise a convoluted and seemingly foolproof plan to rid themselves of their respective employers... permanently.",109,34.26,6.6,5545,"Comedy Crime2011For Nick, Kurt and Dale, the only thing that would make the daily grind more tolerable would be to grind their intolerable bosses into dust. Quitting is not an option, so, with the benefit of a few-too-many drinks and some dubious advice from a hustling ex-con, the three friends devise a convoluted and seemingly foolproof plan to rid themselves of their respective employers... permanently."
813,The Babadook,2014,Drama Horror,"A single mother, plagued by the violent death of her husband, battles with her son's fear of a monster lurking in the house, but soon discovers a sinister presence all around her.",232,25.708,6.5,5196,"Drama Horror2014A single mother, plagued by the violent death of her husband, battles with her son's fear of a monster lurking in the house, but soon discovers a sinister presence all around her."
814,Scooby-Doo,2002,Comedy Mystery Adventure,"The Mystery Inc. gang have gone their separate ways and have been apart for two years, until they each receive an invitation to Spooky Island. Not knowing that the others have also been invited, they show up and discover an amusement park that affects young visitors in very strange ways.",47,130.581,6.0,3674,"Comedy Mystery Adventure2002The Mystery Inc. gang have gone their separate ways and have been apart for two years, until they each receive an invitation to Spooky Island. Not knowing that the others have also been invited, they show up and discover an amusement park that affects young visitors in very strange ways."
815,Begin Again,2013,Comedy Drama Music Romance,"Gretta, a budding songwriter, finds herself alone after her boyfriend Dave ditches her. Her life gains purpose when Dan, a record label executive, notices her talent.",116,19.299,7.3,3316,"Comedy Drama Music Romance2013Gretta, a budding songwriter, finds herself alone after her boyfriend Dave ditches her. Her life gains purpose when Dan, a record label executive, notices her talent."
816,Dough Boys,2009,Drama,"For the “Dough Boys” every day is a struggle to survive. Determined to make something of their lives, these four friends work any hustle no matter how risky. But when they bite off more than they can chew, their loyal bond is tested as they fight to stay alive. Now, the rules of the street that they live by are the very rules that could destroy them.",153,1.33,2.2,3,"Drama2009For the “Dough Boys” every day is a struggle to survive. Determined to make something of their lives, these four friends work any hustle no matter how risky. But when they bite off more than they can chew, their loyal bond is tested as they fight to stay alive. Now, the rules of the street that they live by are the very rules that could destroy them."
817,Conquest of the Planet of the Apes,1972,Action Science Fiction,"In a futuristic world that has embraced ape slavery, a chimpanzee named Caesar resurfaces after almost twenty years of hiding from the authorities, and prepares for a revolt against humanity.",138,14.525,6.1,704,"Action Science Fiction1972In a futuristic world that has embraced ape slavery, a chimpanzee named Caesar resurfaces after almost twenty years of hiding from the authorities, and prepares for a revolt against humanity."
818,Jackass Presents: Bad Grandpa,2013,Comedy,"86-year-old Irving Zisman is on a journey across America with the most unlikely companion: his 8 year-old grandson, Billy.",310,28.093,6.1,1341,"Comedy201386-year-old Irving Zisman is on a journey across America with the most unlikely companion: his 8 year-old grandson, Billy."
819,Star Trek II: The Wrath of Khan,1982,Action Adventure Science Fiction Thriller,"It is the 23rd century. The Federation Starship U.S.S. Enterprise is on routine training maneuvers and Admiral James T. Kirk seems resigned to the fact that this inspection may well be the last space mission of his career. But Khan is back. Aided by his exiled band of genetic supermen, Khan - brilliant renegade of 20th century Earth - has raided Space Station Regula One, stolen a top secret device called Project Genesis, wrested control of another Federation Starship and sets out in pursuit of the Enterprise, determined to let nothing stand in the way of his mission: kill Admiral Kirk... even if it means universal Armageddon.",72,17.408,7.5,1536,"Action Adventure Science Fiction Thriller1982It is the 23rd century. The Federation Starship U.S.S. Enterprise is on routine training maneuvers and Admiral James T. Kirk seems resigned to the fact that this inspection may well be the last space mission of his career. But Khan is back. Aided by his exiled band of genetic supermen, Khan - brilliant renegade of 20th century Earth - has raided Space Station Regula One, stolen a top secret device called Project Genesis, wrested control of another Federation Starship and sets out in pursuit of the Enterprise, determined to let nothing stand in the way of his mission: kill Admiral Kirk... even if it means universal Armageddon."
820,Blood of Redemption,2013,Crime Drama Action Thriller,"Quinn Forte had it all: power, money, a brother who idolized him, and a woman who loved him. He also had enemies. In the course of one night, he loses everything. Betrayed by someone in his inner circle, Quinn is set up and arrested. His father, the patriarch of the criminal empire is killed and his brother suspects that Quinn is behind it all. When he's released from jail he tries to escape the demons from his past, but that becomes an impossible task. Campbell, the ruthless new leader of ""The Company"" won't let him leave in peace. So instead of escaping them, Quinn fights back. He joins forces with his former henchman and friend, The Swede, and takes on his enemies head on.",78,16.283,5.0,40,"Crime Drama Action Thriller2013Quinn Forte had it all: power, money, a brother who idolized him, and a woman who loved him. He also had enemies. In the course of one night, he loses everything. Betrayed by someone in his inner circle, Quinn is set up and arrested. His father, the patriarch of the criminal empire is killed and his brother suspects that Quinn is behind it all. When he's released from jail he tries to escape the demons from his past, but that becomes an impossible task. Campbell, the ruthless new leader of ""The Company"" won't let him leave in peace. So instead of escaping them, Quinn fights back. He joins forces with his former henchman and friend, The Swede, and takes on his enemies head on."
821,Friday After Next,2002,Comedy,"Craig and his cousin Day Day have finally moved out of their parents' houses and into their own crib, working nights at a local mall as security guards. When their house is robbed on Christmas Eve they set out to track down the culprit.",16,16.382,6.2,316,"Comedy2002Craig and his cousin Day Day have finally moved out of their parents' houses and into their own crib, working nights at a local mall as security guards. When their house is robbed on Christmas Eve they set out to track down the culprit."
822,Brooklyn,2015,Drama Romance,"In 1950s Ireland and New York, young Eilis Lacey has to choose between two men and two countries.",63,17.556,7.3,2759,"Drama Romance2015In 1950s Ireland and New York, young Eilis Lacey has to choose between two men and two countries."
823,Planet of the Apes,2001,Action Adventure Science Fiction Thriller,"After a spectacular crash-landing on an uncharted planet, brash astronaut Leo Davidson finds himself trapped in a savage world where talking apes dominate the human race. Desperate to find a way home, Leo must evade the invincible gorilla army led by Ruthless General Thade.",138,54.165,5.7,3351,"Action Adventure Science Fiction Thriller2001After a spectacular crash-landing on an uncharted planet, brash astronaut Leo Davidson finds himself trapped in a savage world where talking apes dominate the human race. Desperate to find a way home, Leo must evade the invincible gorilla army led by Ruthless General Thade."
824,Marley & Me,2008,Comedy Family,"A newly married couple who, in the process of starting a family, learn many of life's important lessons from their trouble-loving retriever, Marley. Packed with plenty of laughs to lighten the load, the film explores the highs and lows of marriage, maturity and confronting one's own mortality, as seen through the lens of family life with a dog.",90,51.017,7.2,4037,"Comedy Family2008A newly married couple who, in the process of starting a family, learn many of life's important lessons from their trouble-loving retriever, Marley. Packed with plenty of laughs to lighten the load, the film explores the highs and lows of marriage, maturity and confronting one's own mortality, as seen through the lens of family life with a dog."
825,Strangerland,2015,Drama Mystery Thriller,"Newly arrived to a remote desert town, Catherine and Matthew are tormented by a suspicion when their two teenage children mysteriously vanish.",69,9.408,5.3,211,"Drama Mystery Thriller2015Newly arrived to a remote desert town, Catherine and Matthew are tormented by a suspicion when their two teenage children mysteriously vanish."
826,The Giver,2014,Drama Science Fiction,"In a seemingly perfect community, without war, pain, suffering, differences or choice, a young boy is chosen to learn from an elderly man about the true pain and pleasure of the ""real"" world.",125,25.865,6.5,4060,"Drama Science Fiction2014In a seemingly perfect community, without war, pain, suffering, differences or choice, a young boy is chosen to learn from an elderly man about the true pain and pleasure of the ""real"" world."
