,original_name,release_date,genres,overview,total_views,popularity,vote_average,vote_count,content
0,Moana,2016,Animation Comedy Family Adventure,"In Ancient Polynesia, when a terrible curse incurred by Maui reaches an impetuous Chieftain's daughter's island, she answers the Ocean's call to seek out the demigod to set things right.",25683,47.75,7.6,10631,"Animation Comedy Family Adventure2016In Ancient Polynesia, when a terrible curse incurred by Maui reaches an impetuous Chieftain's daughter's island, she answers the Ocean's call to seek out the demigod to set things right."
1,Churchill,2017,Drama History,A ticking-clock thriller following Winston Churchill in the 24 hours before D-Day.,2898,15.256,6.1,260,Drama History2017A ticking-clock thriller following Winston Churchill in the 24 hours before D-Day.
2,Coco,2017,Animation Comedy Family Adventure Fantasy Music,"Despite his family’s baffling generations-old ban on music, Miguel dreams of becoming an accomplished musician like his idol, Ernesto de la Cruz. Desperate to prove his talent, Miguel finds himself in the stunning and colorful Land of the Dead following a mysterious chain of events. Along the way, he meets charming trickster Hector, and together, they set off on an extraordinary journey to unlock the real story behind Miguel's family history.",10867,234.074,8.2,16037,"Animation Comedy Family Adventure Fantasy Music2017Despite his family’s baffling generations-old ban on music, Miguel dreams of becoming an accomplished musician like his idol, Ernesto de la Cruz. Desperate to prove his talent, Miguel finds himself in the stunning and colorful Land of the Dead following a mysterious chain of events. Along the way, he meets charming trickster Hector, and together, they set off on an extraordinary journey to unlock the real story behind Miguel's family history."
3,Kidnap,2017,Drama Thriller,A mother (in her Minivan) stops at nothing to recover her kidnapped son.,2263,35.231,6.2,1130,Drama Thriller2017A mother (in her Minivan) stops at nothing to recover her kidnapped son.
4,The Accountant,2016,Crime Drama Thriller,"As a math savant uncooks the books for a new client, the Treasury Department closes in on his activities and the body count starts to rise.",4157,35.596,7.0,5158,"Crime Drama Thriller2016As a math savant uncooks the books for a new client, the Treasury Department closes in on his activities and the body count starts to rise."
5,The Birth of a Nation,2016,Drama,"Nat Turner, a former slave in America, leads a liberation movement in 1831 to free African-Americans in Virginia that results in a violent retaliation from whites.",7189,11.877,6.5,469,"Drama2016Nat Turner, a former slave in America, leads a liberation movement in 1831 to free African-Americans in Virginia that results in a violent retaliation from whites."
6,Baywatch,2017,Comedy Crime Action,"Devoted lifeguard Mitch Buchannon butts heads with a brash new recruit. Together, they uncover a local criminal plot that threatens the future of the Bay.",23031,80.666,6.1,7075,"Comedy Crime Action2017Devoted lifeguard Mitch Buchannon butts heads with a brash new recruit. Together, they uncover a local criminal plot that threatens the future of the Bay."
7,Alien: Covenant,2017,Mystery Horror Science Fiction,"Bound for a remote planet on the far side of the galaxy, the crew of the colony ship 'Covenant' discovers what is thought to be an uncharted paradise, but is actually a dark, dangerous world—which has a sole inhabitant: the 'synthetic', David, survivor of the doomed Prometheus expedition.",14477,120.823,6.1,7224,"Mystery Horror Science Fiction2017Bound for a remote planet on the far side of the galaxy, the crew of the colony ship 'Covenant' discovers what is thought to be an uncharted paradise, but is actually a dark, dangerous world—which has a sole inhabitant: the 'synthetic', David, survivor of the doomed Prometheus expedition."
8,Kingsman: The Golden Circle,2017,Comedy Crime Action Adventure Science Fiction,"When an attack on the Kingsman headquarters takes place and a new villain rises, Eggsy and Merlin are forced to work together with the American agency known as the Statesman to save the world.",3141,80.618,7.0,8785,"Comedy Crime Action Adventure Science Fiction2017When an attack on the Kingsman headquarters takes place and a new villain rises, Eggsy and Merlin are forced to work together with the American agency known as the Statesman to save the world."
9,Pitch Perfect,2012,Comedy Music Romance,"College student Beca knows she does not want to be part of a clique, but that's exactly where she finds herself after arriving at her new school. Thrust in among mean gals, nice gals and just plain weird gals, Beca finds that the only thing they have in common is how well they sing together. She takes the women of the group out of their comfort zone of traditional arrangements and into a world of amazing harmonic combinations in a fight to the top of college music competitions.",3423,36.921,7.3,5876,"Comedy Music Romance2012College student Beca knows she does not want to be part of a clique, but that's exactly where she finds herself after arriving at her new school. Thrust in among mean gals, nice gals and just plain weird gals, Beca finds that the only thing they have in common is how well they sing together. She takes the women of the group out of their comfort zone of traditional arrangements and into a world of amazing harmonic combinations in a fight to the top of college music competitions."
10,Sully,2016,Drama History,"On 15 January 2009, the world witnessed the 'Miracle on the Hudson' when Captain 'Sully' Sullenberger glided his disabled plane onto the frigid waters of the Hudson River, saving the lives of all 155 aboard. However, even as Sully was being heralded by the public and the media for his unprecedented feat of aviation skill, an investigation was unfolding that threatened to destroy his reputation and career.",4842,29.799,7.2,6146,"Drama History2016On 15 January 2009, the world witnessed the 'Miracle on the Hudson' when Captain 'Sully' Sullenberger glided his disabled plane onto the frigid waters of the Hudson River, saving the lives of all 155 aboard. However, even as Sully was being heralded by the public and the media for his unprecedented feat of aviation skill, an investigation was unfolding that threatened to destroy his reputation and career."
11,Goat,2016,Drama,"Reeling from a terrifying assault, a nineteen year old enrolls into college with his brother and pledges the same fraternity. What happens there, in the name of 'brotherhood,' tests him and his loyalty in brutal ways.",622,8.938,5.4,228,"Drama2016Reeling from a terrifying assault, a nineteen year old enrolls into college with his brother and pledges the same fraternity. What happens there, in the name of 'brotherhood,' tests him and his loyalty in brutal ways."
12,Last Knights,2015,Action Adventure,"When an evil emperor executes their leader, his band of knights – bound by duty and honour – embarks on a journey of vengeance that will not come to an end until they've destroyed their mortal foe.",343,22.512,6.5,921,"Action Adventure2015When an evil emperor executes their leader, his band of knights – bound by duty and honour – embarks on a journey of vengeance that will not come to an end until they've destroyed their mortal foe."
13,Geostorm,2017,Action Science Fiction Thriller,"After an unprecedented series of natural disasters threatened the planet, the world's leaders came together to create an intricate network of satellites to control the global climate and keep everyone safe. But now, something has gone wrong: the system built to protect Earth is attacking it, and it becomes a race against the clock to uncover the real threat before a worldwide geostorm wipes out everything and everyone along with it.",11966,52.917,6.1,4023,"Action Science Fiction Thriller2017After an unprecedented series of natural disasters threatened the planet, the world's leaders came together to create an intricate network of satellites to control the global climate and keep everyone safe. But now, something has gone wrong: the system built to protect Earth is attacking it, and it becomes a race against the clock to uncover the real threat before a worldwide geostorm wipes out everything and everyone along with it."
14,Trolls,2016,Animation Comedy Family Adventure Fantasy Music,"Lovable and friendly, the trolls love to play around. But one day, a mysterious giant shows up to end the party. Poppy, the optimistic leader of the Trolls, and her polar opposite, Branch, must embark on an adventure that takes them far beyond the only world they’ve ever known.",37295,63.721,6.7,3073,"Animation Comedy Family Adventure Fantasy Music2016Lovable and friendly, the trolls love to play around. But one day, a mysterious giant shows up to end the party. Poppy, the optimistic leader of the Trolls, and her polar opposite, Branch, must embark on an adventure that takes them far beyond the only world they’ve ever known."
15,Underworld: Awakening,2012,Action Fantasy Horror,"Having escaped years of imprisonment, vampire warrioress Selene finds herself in a changed world where humans have discovered the existence of both Vampire and Lycan clans and are conducting an all-out war to eradicate both immortal species. Now Selene must battle the humans and a frightening new breed of super Lycans to ensure the death dealers' survival.",3553,73.545,6.3,3548,"Action Fantasy Horror2012Having escaped years of imprisonment, vampire warrioress Selene finds herself in a changed world where humans have discovered the existence of both Vampire and Lycan clans and are conducting an all-out war to eradicate both immortal species. Now Selene must battle the humans and a frightening new breed of super Lycans to ensure the death dealers' survival."
16,Game of Aces,2016,Action Adventure War,A rescue attempt of a German traitor during World War I has unexpected consequences and sets off an adventure across the Arabian desert.,288,2.044,5.0,2,Action Adventure War2016A rescue attempt of a German traitor during World War I has unexpected consequences and sets off an adventure across the Arabian desert.
17,Extraterrestrial,2014,Horror Science Fiction,"Five friends set out to a cabin in the woods for a fun weekend getaway that is, until extraterrestrial visitors turn it into a fight for their lives. The group is pulled from their reverie when a flickering object crashes deep in the woods. As they investigate, the friends stumble across an alien spacecraft, and its inhabitants have not arrived in peace.",1960,10.839,5.5,408,"Horror Science Fiction2014Five friends set out to a cabin in the woods for a fun weekend getaway that is, until extraterrestrial visitors turn it into a fight for their lives. The group is pulled from their reverie when a flickering object crashes deep in the woods. As they investigate, the friends stumble across an alien spacecraft, and its inhabitants have not arrived in peace."
18,The Jetsons & WWE: Robo-WrestleMania!,2017,Animation Comedy Family Science Fiction,"Blast off to adventure in this animated feature where our favorite space-age family, The Jetsons, meet the superstars of WWE! When George unearths WWE’s Big Show, who has been frozen for 100 years, the futuristic face-off begins! Once thawed, Big Show wastes no time in taking the WWE belt from the current robot champ as well as taking total control of Orbit City. It’s up to The Jetsons to travel back in time and enlist help from WWE’s brightest stars: Sheamus, Alicia Fox, Roman Reigns, Seth Rollins and the Uso brothers. Can this cosmic tag-team prevail and set this twisted time-warp straight? Tune in and see with The Jetsons and WWE!",12422,4.293,8.7,26,"Animation Comedy Family Science Fiction2017Blast off to adventure in this animated feature where our favorite space-age family, The Jetsons, meet the superstars of WWE! When George unearths WWE’s Big Show, who has been frozen for 100 years, the futuristic face-off begins! Once thawed, Big Show wastes no time in taking the WWE belt from the current robot champ as well as taking total control of Orbit City. It’s up to The Jetsons to travel back in time and enlist help from WWE’s brightest stars: Sheamus, Alicia Fox, Roman Reigns, Seth Rollins and the Uso brothers. Can this cosmic tag-team prevail and set this twisted time-warp straight? Tune in and see with The Jetsons and WWE!"
19,Ferdinand,2017,Animation Comedy Family Adventure,"Ferdinand, a little bull, prefers sitting quietly under a cork tree just smelling the flowers versus jumping around, snorting, and butting heads with other bulls. As Ferdinand grows big and strong, his temperament remains mellow, but one day five men come to choose the ""biggest, fastest, roughest bull"" for the bullfights in Madrid and Ferdinand is mistakenly chosen.  Based on the classic 1936 children's book by Munro Leaf.",22775,77.954,7.3,2433,"Animation Comedy Family Adventure2017Ferdinand, a little bull, prefers sitting quietly under a cork tree just smelling the flowers versus jumping around, snorting, and butting heads with other bulls. As Ferdinand grows big and strong, his temperament remains mellow, but one day five men come to choose the ""biggest, fastest, roughest bull"" for the bullfights in Madrid and Ferdinand is mistakenly chosen.  Based on the classic 1936 children's book by Munro Leaf."
20,Monsters University,2013,Animation Family,A look at the relationship between Mike and Sulley during their days at Monsters University — when they weren't necessarily the best of friends.,1038,94.575,7.0,9232,Animation Family2013A look at the relationship between Mike and Sulley during their days at Monsters University — when they weren't necessarily the best of friends.
21,War for the Planet of the Apes,2017,Drama Science Fiction War,"Caesar and his apes are forced into a deadly conflict with an army of humans led by a ruthless Colonel. After the apes suffer unimaginable losses, Caesar wrestles with his darker instincts and begins his own mythic quest to avenge his kind. As the journey finally brings them face to face, Caesar and the Colonel are pitted against each other in an epic battle that will determine the fate of both their species and the future of the planet.",6402,76.994,7.1,7469,"Drama Science Fiction War2017Caesar and his apes are forced into a deadly conflict with an army of humans led by a ruthless Colonel. After the apes suffer unimaginable losses, Caesar wrestles with his darker instincts and begins his own mythic quest to avenge his kind. As the journey finally brings them face to face, Caesar and the Colonel are pitted against each other in an epic battle that will determine the fate of both their species and the future of the planet."
22,Surf's Up,2007,Animation Comedy Family,"Cody is a surfing penguin from Shiverpool who dreams of making it big and being like his idol Big Z. On his journey, he discovers his talents are not all he thinks they are, and he must learn to accept that there is more to surfing than fame and fortune.",2561,23.311,6.3,2025,"Animation Comedy Family2007Cody is a surfing penguin from Shiverpool who dreams of making it big and being like his idol Big Z. On his journey, he discovers his talents are not all he thinks they are, and he must learn to accept that there is more to surfing than fame and fortune."
23,Instant Death,2017,Crime Action,"A vicious gang war for drug dominance draws in a disturbed Special Forces veteran John Bradley. Trying to adjust to normal life and haunted by inner demons of a violent past, the underworld's retribution on his last connection to humanity, a daughter and grandchild leads to a descent of fury and violence that not even the brutality of gangland is prepared for.",11203,11.244,5.5,46,"Crime Action2017A vicious gang war for drug dominance draws in a disturbed Special Forces veteran John Bradley. Trying to adjust to normal life and haunted by inner demons of a violent past, the underworld's retribution on his last connection to humanity, a daughter and grandchild leads to a descent of fury and violence that not even the brutality of gangland is prepared for."
24,Free Fire,2017,Crime Mystery Action,"In 1970’s Boston, a meeting in a deserted warehouse between two gangs turns into a shoot-out and a game of survival.",1397,19.813,6.3,921,"Crime Mystery Action2017In 1970’s Boston, a meeting in a deserted warehouse between two gangs turns into a shoot-out and a game of survival."
25,Snatched,2017,Comedy Action,"When her boyfriend dumps Emily, a spontaneous woman in her 30s, she persuades her ultra-cautious mom to accompany her on a vacation to Ecuador. When these two very different women are trapped on this wild journey, their bond as mother and daughter is tested and strengthened while they attempt to navigate the jungle and escape.",11050,14.329,5.4,712,"Comedy Action2017When her boyfriend dumps Emily, a spontaneous woman in her 30s, she persuades her ultra-cautious mom to accompany her on a vacation to Ecuador. When these two very different women are trapped on this wild journey, their bond as mother and daughter is tested and strengthened while they attempt to navigate the jungle and escape."
26,No Reservations,2007,Comedy Drama Romance,"Master chef Kate Armstrong runs her life and her kitchen with intimidating intensity. However, a recipe for disaster may be in the works when she becomes the guardian of her young niece while crossing forks with the brash sous-chef who just joined her staff. Though romance blooms in the face of rivalry, Kate needs to look outside the kitchen to find true happiness.",381,13.328,6.5,1039,"Comedy Drama Romance2007Master chef Kate Armstrong runs her life and her kitchen with intimidating intensity. However, a recipe for disaster may be in the works when she becomes the guardian of her young niece while crossing forks with the brash sous-chef who just joined her staff. Though romance blooms in the face of rivalry, Kate needs to look outside the kitchen to find true happiness."
27,The Nice Guys,2016,Comedy Crime Action,A private eye investigates the apparent suicide of a fading porn star in 1970s Los Angeles and uncovers a conspiracy.,1233,45.93,7.1,6579,Comedy Crime Action2016A private eye investigates the apparent suicide of a fading porn star in 1970s Los Angeles and uncovers a conspiracy.
28,Dunkirk,2017,Drama Action War,"The story of the miraculous evacuation of Allied soldiers from Belgium, Britain, Canada and France, who were cut off and surrounded by the German army from the beaches and harbour of Dunkirk between May 26th and June 4th 1940 during World War II.",11772,35.925,7.5,14306,"Drama Action War2017The story of the miraculous evacuation of Allied soldiers from Belgium, Britain, Canada and France, who were cut off and surrounded by the German army from the beaches and harbour of Dunkirk between May 26th and June 4th 1940 during World War II."
29,The Hunter's Prayer,2017,Action Thriller,An assassin forges an unlikely partnership with one of his targets: a woman seeking revenge for the murder of her family.,4927,11.3,5.7,319,Action Thriller2017An assassin forges an unlikely partnership with one of his targets: a woman seeking revenge for the murder of her family.
30,Puerto Ricans in Paris,2015,Comedy,"NYPD detectives Luis and Eddie visit Paris to help gorgeous French designer Colette catch the black market thief who's ripped off her new handbag design. While Luis' girlfriend Vanessa and Eddie's wife Gloria remain in New York, the hopelessly unhip odd couple stumble through a glamorous high-fashion world brimming with charming cafes, wild nightclubs and corporate treachery.",1926,4.763,5.8,30,"Comedy2015NYPD detectives Luis and Eddie visit Paris to help gorgeous French designer Colette catch the black market thief who's ripped off her new handbag design. While Luis' girlfriend Vanessa and Eddie's wife Gloria remain in New York, the hopelessly unhip odd couple stumble through a glamorous high-fashion world brimming with charming cafes, wild nightclubs and corporate treachery."
31,All the Boys Love Mandy Lane,2006,Mystery Horror Thriller,"Beautiful Mandy Lane isn't a party girl but, when classmate Chloe invites the Texas high school student to a bash in the countryside, she reluctantly accepts. After hitching a ride with a vaguely scary older man, the teens arrive at their destination. Partying ensues, and Mandy's close pal, Emmet, keeps a watchful eye on the young males making a play for Mandy. Then two of the students are murdered.",298,12.789,5.5,531,"Mystery Horror Thriller2006Beautiful Mandy Lane isn't a party girl but, when classmate Chloe invites the Texas high school student to a bash in the countryside, she reluctantly accepts. After hitching a ride with a vaguely scary older man, the teens arrive at their destination. Partying ensues, and Mandy's close pal, Emmet, keeps a watchful eye on the young males making a play for Mandy. Then two of the students are murdered."
32,Soul Men,2008,Comedy Music,"Two former backup soul singers, Louis and Floyd, have not spoken to each other in 20 years, and reluctantly agree to travel across the country together to a reunion concert to honor their recently-deceased lead singer. Cleo, a beautiful young woman who is believed to be Floyd's daughter, accompanies them as a new singer.",108,11.155,6.2,124,"Comedy Music2008Two former backup soul singers, Louis and Floyd, have not spoken to each other in 20 years, and reluctantly agree to travel across the country together to a reunion concert to honor their recently-deceased lead singer. Cleo, a beautiful young woman who is believed to be Floyd's daughter, accompanies them as a new singer."
33,Baby Driver,2017,Crime Action,"After being coerced into working for a crime boss, a young getaway driver finds himself taking part in a heist doomed to fail.",1817,69.615,7.5,13471,"Crime Action2017After being coerced into working for a crime boss, a young getaway driver finds himself taking part in a heist doomed to fail."
34,Total Recall,2012,Action Science Fiction Thriller,"Welcome to Rekall, the company that can turn your dreams into real memories. For a factory worker named Douglas Quaid, even though he's got a beautiful wife who he loves, the mind-trip sounds like the perfect vacation from his frustrating life - real memories of life as a super-spy might be just what he needs. But when the procedure goes horribly wrong, Quaid becomes a hunted man. Finding himself on the run from the police - controlled by Chancellor Cohaagen, the leader of the free world - Quaid teams up with a rebel fighter to find the head of the underground resistance and stop Cohaagen. The line between fantasy and reality gets blurred and the fate of his world hangs in the balance as Quaid discovers his true identity, his true love, and his true fate.",3470,59.885,6.0,4752,"Action Science Fiction Thriller2012Welcome to Rekall, the company that can turn your dreams into real memories. For a factory worker named Douglas Quaid, even though he's got a beautiful wife who he loves, the mind-trip sounds like the perfect vacation from his frustrating life - real memories of life as a super-spy might be just what he needs. But when the procedure goes horribly wrong, Quaid becomes a hunted man. Finding himself on the run from the police - controlled by Chancellor Cohaagen, the leader of the free world - Quaid teams up with a rebel fighter to find the head of the underground resistance and stop Cohaagen. The line between fantasy and reality gets blurred and the fate of his world hangs in the balance as Quaid discovers his true identity, his true love, and his true fate."
35,Collateral Beauty,2016,Drama Romance,"Retreating from life after a tragedy, a man questions the universe by writing to Love, Time and Death. Receiving unexpected answers, he begins to see how these things interlock and how even loss can reveal moments of meaning and beauty.",22449,31.081,7.3,4928,"Drama Romance2016Retreating from life after a tragedy, a man questions the universe by writing to Love, Time and Death. Receiving unexpected answers, he begins to see how these things interlock and how even loss can reveal moments of meaning and beauty."
36,Assassin's Creed,2016,Action Adventure Science Fiction,"Through unlocked genetic memories that allow him to relive the adventures of his ancestor in 15th century Spain, Callum Lynch discovers he's a descendant of the secret 'Assassins' society. After gaining incredible knowledge and skills, he is now poised to take on the oppressive Knights Templar in the present day.",5894,43.292,5.4,6914,"Action Adventure Science Fiction2016Through unlocked genetic memories that allow him to relive the adventures of his ancestor in 15th century Spain, Callum Lynch discovers he's a descendant of the secret 'Assassins' society. After gaining incredible knowledge and skills, he is now poised to take on the oppressive Knights Templar in the present day."
37,The Girl on the Train,2016,Crime Drama Mystery Thriller,"Rachel Watson, devastated by her recent divorce, spends her daily commute fantasizing about the seemingly perfect couple who live in a house that her train passes every day, until one morning she sees something shocking happen there and becomes entangled in the mystery that unfolds.",2461,32.506,6.4,5077,"Crime Drama Mystery Thriller2016Rachel Watson, devastated by her recent divorce, spends her daily commute fantasizing about the seemingly perfect couple who live in a house that her train passes every day, until one morning she sees something shocking happen there and becomes entangled in the mystery that unfolds."
